{
  "format": "classifyre.glossary-pack/v1",
  "key": "secrets-and-credentials",
  "version": "1.0.0",
  "name": "Secrets and credentials",
  "language": "en",
  "description": "Kinds of secret, bound to the built-in SECRETS detector's type names (detect-secrets plugins).",
  "sources": [
    "https://github.com/Yelp/detect-secrets"
  ],
  "schemes": [
    {
      "key": "secrets-and-credentials",
      "name": "Secrets and credentials"
    }
  ],
  "terms": [
    {
      "key": "secret",
      "kind": "CONCEPT",
      "term": "Secret",
      "scheme": "secrets-and-credentials",
      "definition": "A value that grants access and must not be disclosed.",
      "aliases": [
        "credential",
        "Zugangsdaten"
      ]
    },
    {
      "key": "cloud-credential",
      "kind": "CONCEPT",
      "term": "Cloud credential",
      "scheme": "secrets-and-credentials",
      "definition": "An access key or credential for a cloud platform account.",
      "aliases": [
        "cloud access key"
      ]
    },
    {
      "key": "source-platform-token",
      "kind": "CONCEPT",
      "term": "Source-platform token",
      "scheme": "secrets-and-credentials",
      "definition": "A token for a code-hosting or package platform (GitHub, GitLab, npm, PyPI, Artifactory).",
      "aliases": [
        "repository token"
      ]
    },
    {
      "key": "api-key",
      "kind": "CONCEPT",
      "term": "API key",
      "scheme": "secrets-and-credentials",
      "definition": "A key that authenticates calls to a third-party API.",
      "aliases": [
        "API token"
      ]
    },
    {
      "key": "private-key",
      "kind": "CONCEPT",
      "term": "Private key",
      "scheme": "secrets-and-credentials",
      "definition": "The private half of an asymmetric key pair.",
      "aliases": [
        "private key file"
      ]
    },
    {
      "key": "password",
      "kind": "CONCEPT",
      "term": "Password",
      "scheme": "secrets-and-credentials",
      "definition": "A password or a credential embedded in configuration or URLs.",
      "aliases": [
        "Passwort",
        "secret keyword"
      ]
    },
    {
      "key": "token",
      "kind": "CONCEPT",
      "term": "Token",
      "scheme": "secrets-and-credentials",
      "definition": "A bearer token: chat-bot, webhook or JSON Web Token.",
      "aliases": [
        "bearer token"
      ]
    },
    {
      "key": "high-entropy-string",
      "kind": "CONCEPT",
      "term": "High-entropy string",
      "scheme": "secrets-and-credentials",
      "definition": "A random-looking string that may be a secret; detected by entropy, not by format.",
      "aliases": [
        "entropy string"
      ]
    }
  ],
  "relations": [
    {
      "from": "cloud-credential",
      "type": "BROADER",
      "to": "secret"
    },
    {
      "from": "source-platform-token",
      "type": "BROADER",
      "to": "secret"
    },
    {
      "from": "api-key",
      "type": "BROADER",
      "to": "secret"
    },
    {
      "from": "private-key",
      "type": "BROADER",
      "to": "secret"
    },
    {
      "from": "password",
      "type": "BROADER",
      "to": "secret"
    },
    {
      "from": "token",
      "type": "BROADER",
      "to": "secret"
    },
    {
      "from": "high-entropy-string",
      "type": "BROADER",
      "to": "secret"
    }
  ],
  "bindings": [
    {
      "mode": "OUTPUT",
      "output": {
        "detectorType": "SECRETS",
        "findingType": "AWS Access Key"
      },
      "termKey": "cloud-credential"
    },
    {
      "mode": "OUTPUT",
      "output": {
        "detectorType": "SECRETS",
        "findingType": "Azure Storage Account access key"
      },
      "termKey": "cloud-credential"
    },
    {
      "mode": "OUTPUT",
      "output": {
        "detectorType": "SECRETS",
        "findingType": "IBM Cloud IAM Key"
      },
      "termKey": "cloud-credential"
    },
    {
      "mode": "OUTPUT",
      "output": {
        "detectorType": "SECRETS",
        "findingType": "IBM COS HMAC Credentials"
      },
      "termKey": "cloud-credential"
    },
    {
      "mode": "OUTPUT",
      "output": {
        "detectorType": "SECRETS",
        "findingType": "SoftLayer Credentials"
      },
      "termKey": "cloud-credential"
    },
    {
      "mode": "OUTPUT",
      "output": {
        "detectorType": "SECRETS",
        "findingType": "GitHub Token"
      },
      "termKey": "source-platform-token"
    },
    {
      "mode": "OUTPUT",
      "output": {
        "detectorType": "SECRETS",
        "findingType": "GitLab Token"
      },
      "termKey": "source-platform-token"
    },
    {
      "mode": "OUTPUT",
      "output": {
        "detectorType": "SECRETS",
        "findingType": "NPM tokens"
      },
      "termKey": "source-platform-token"
    },
    {
      "mode": "OUTPUT",
      "output": {
        "detectorType": "SECRETS",
        "findingType": "PyPI upload token"
      },
      "termKey": "source-platform-token"
    },
    {
      "mode": "OUTPUT",
      "output": {
        "detectorType": "SECRETS",
        "findingType": "Artifactory Credentials"
      },
      "termKey": "source-platform-token"
    },
    {
      "mode": "OUTPUT",
      "output": {
        "detectorType": "SECRETS",
        "findingType": "Mailchimp Access Key"
      },
      "termKey": "api-key"
    },
    {
      "mode": "OUTPUT",
      "output": {
        "detectorType": "SECRETS",
        "findingType": "SendGrid API Key"
      },
      "termKey": "api-key"
    },
    {
      "mode": "OUTPUT",
      "output": {
        "detectorType": "SECRETS",
        "findingType": "Stripe Access Key"
      },
      "termKey": "api-key"
    },
    {
      "mode": "OUTPUT",
      "output": {
        "detectorType": "SECRETS",
        "findingType": "Twilio API Key"
      },
      "termKey": "api-key"
    },
    {
      "mode": "OUTPUT",
      "output": {
        "detectorType": "SECRETS",
        "findingType": "OpenAI Token"
      },
      "termKey": "api-key"
    },
    {
      "mode": "OUTPUT",
      "output": {
        "detectorType": "SECRETS",
        "findingType": "Square OAuth Secret"
      },
      "termKey": "api-key"
    },
    {
      "mode": "OUTPUT",
      "output": {
        "detectorType": "SECRETS",
        "findingType": "Cloudant Credentials"
      },
      "termKey": "api-key"
    },
    {
      "mode": "OUTPUT",
      "output": {
        "detectorType": "SECRETS",
        "findingType": "Slack Token"
      },
      "termKey": "token"
    },
    {
      "mode": "OUTPUT",
      "output": {
        "detectorType": "SECRETS",
        "findingType": "Discord Bot Token"
      },
      "termKey": "token"
    },
    {
      "mode": "OUTPUT",
      "output": {
        "detectorType": "SECRETS",
        "findingType": "Telegram Bot Token"
      },
      "termKey": "token"
    },
    {
      "mode": "OUTPUT",
      "output": {
        "detectorType": "SECRETS",
        "findingType": "JSON Web Token"
      },
      "termKey": "token"
    },
    {
      "mode": "OUTPUT",
      "output": {
        "detectorType": "SECRETS",
        "findingType": "Private Key"
      },
      "termKey": "private-key"
    },
    {
      "mode": "OUTPUT",
      "output": {
        "detectorType": "SECRETS",
        "findingType": "Secret Keyword"
      },
      "termKey": "password"
    },
    {
      "mode": "OUTPUT",
      "output": {
        "detectorType": "SECRETS",
        "findingType": "Basic Auth Credentials"
      },
      "termKey": "password"
    },
    {
      "mode": "OUTPUT",
      "output": {
        "detectorType": "SECRETS",
        "findingType": "Hex High Entropy String"
      },
      "termKey": "high-entropy-string"
    },
    {
      "mode": "OUTPUT",
      "output": {
        "detectorType": "SECRETS",
        "findingType": "Base64 High Entropy String"
      },
      "termKey": "high-entropy-string"
    }
  ]
}
